
*** Running vivado
    with args -log topModule.vdi -applog -m64 -product Vivado -messageDb vivado.pb -mode batch -source topModule.tcl -notrace



****** Vivado v2022.2 (64-bit)
  **** SW Build 3671981 on Fri Oct 14 05:00:03 MDT 2022
  **** IP Build 3669848 on Fri Oct 14 08:30:02 MDT 2022
    ** Copyright 1986-2022 Xilinx, Inc. All Rights Reserved.

source topModule.tcl -notrace
create_project: Time (s): cpu = 00:00:06 ; elapsed = 00:00:07 . Memory (MB): peak = 558.352 ; gain = 124.617
Command: link_design -top topModule -part xc7s50csga324-1
Design is defaulting to srcset: sources_1
Design is defaulting to constrset: constrs_1
INFO: [Device 21-403] Loading part xc7s50csga324-1
INFO: [Project 1-454] Reading design checkpoint 'd:/Github/FlybackConverter-FPGA-based-Digital-Twin/Vivado/flyback_converter_serial.xpr/callPWM/callPWM.gen/sources_1/ip/xadc_wiz_0/xadc_wiz_0.dcp' for cell 'u1/xadc'
Netlist sorting complete. Time (s): cpu = 00:00:00 ; elapsed = 00:00:00.013 . Memory (MB): peak = 979.438 ; gain = 0.000
INFO: [Netlist 29-17] Analyzing 271 Unisim elements for replacement
INFO: [Netlist 29-28] Unisim Transformation completed in 0 CPU seconds
INFO: [Project 1-479] Netlist was created with Vivado 2020.1
INFO: [Project 1-570] Preparing netlist for logic optimization
Parsing XDC File [d:/Github/FlybackConverter-FPGA-based-Digital-Twin/Vivado/flyback_converter_serial.xpr/callPWM/callPWM.gen/sources_1/ip/xadc_wiz_0/xadc_wiz_0.xdc] for cell 'u1/xadc/inst'
Finished Parsing XDC File [d:/Github/FlybackConverter-FPGA-based-Digital-Twin/Vivado/flyback_converter_serial.xpr/callPWM/callPWM.gen/sources_1/ip/xadc_wiz_0/xadc_wiz_0.xdc] for cell 'u1/xadc/inst'
Parsing XDC File [D:/Github/FlybackConverter-FPGA-based-Digital-Twin/Vivado/flyback_converter_serial.xpr/callPWM/callPWM.srcs/constrs_1/imports/digilent-xdc-master/Arty-S7-50-Master.xdc]
WARNING: [Vivado 12-584] No ports matched 'CLK100MHZ'. [D:/Github/FlybackConverter-FPGA-based-Digital-Twin/Vivado/flyback_converter_serial.xpr/callPWM/callPWM.srcs/constrs_1/imports/digilent-xdc-master/Arty-S7-50-Master.xdc:10]
CRITICAL WARNING: [Vivado 12-4739] create_clock:No valid object(s) found for '-objects [get_ports CLK100MHZ]'. [D:/Github/FlybackConverter-FPGA-based-Digital-Twin/Vivado/flyback_converter_serial.xpr/callPWM/callPWM.srcs/constrs_1/imports/digilent-xdc-master/Arty-S7-50-Master.xdc:10]
Resolution: Check if the specified object(s) exists in the current design. If it does, ensure that the correct design hierarchy was specified for the object. If you are working with clocks, make sure create_clock was used to create the clock object before it is referenced.
Finished Parsing XDC File [D:/Github/FlybackConverter-FPGA-based-Digital-Twin/Vivado/flyback_converter_serial.xpr/callPWM/callPWM.srcs/constrs_1/imports/digilent-xdc-master/Arty-S7-50-Master.xdc]
INFO: [Opt 31-138] Pushed 0 inverter(s) to 0 load pin(s).
Netlist sorting complete. Time (s): cpu = 00:00:00 ; elapsed = 00:00:00.001 . Memory (MB): peak = 1095.086 ; gain = 0.000
INFO: [Project 1-111] Unisim Transformation Summary:
No Unisim elements were transformed.

8 Infos, 1 Warnings, 1 Critical Warnings and 0 Errors encountered.
link_design completed successfully
link_design: Time (s): cpu = 00:00:05 ; elapsed = 00:00:06 . Memory (MB): peak = 1095.086 ; gain = 505.434
Command: opt_design
Attempting to get a license for feature 'Implementation' and/or device 'xc7s50'
INFO: [Common 17-349] Got license for feature 'Implementation' and/or device 'xc7s50'
Running DRC as a precondition to command opt_design

Starting DRC Task
INFO: [DRC 23-27] Running DRC with 2 threads
INFO: [Project 1-461] DRC finished with 0 Errors
INFO: [Project 1-462] Please refer to the DRC report (report_drc) for more information.

Time (s): cpu = 00:00:02 ; elapsed = 00:00:02 . Memory (MB): peak = 1124.016 ; gain = 28.930

Starting Cache Timing Information Task
INFO: [Timing 38-35] Done setting XDC timing constraints.
Ending Cache Timing Information Task | Checksum: 20be8ed70

Time (s): cpu = 00:00:07 ; elapsed = 00:00:09 . Memory (MB): peak = 1511.191 ; gain = 387.176

Starting Logic Optimization Task

Phase 1 Retarget
INFO: [Opt 31-138] Pushed 0 inverter(s) to 0 load pin(s).
INFO: [Opt 31-49] Retargeted 0 cell(s).
Phase 1 Retarget | Checksum: 20be8ed70

Time (s): cpu = 00:00:00 ; elapsed = 00:00:00.112 . Memory (MB): peak = 1845.090 ; gain = 0.000
INFO: [Opt 31-389] Phase Retarget created 0 cells and removed 0 cells

Phase 2 Constant propagation
INFO: [Opt 31-138] Pushed 0 inverter(s) to 0 load pin(s).
Phase 2 Constant propagation | Checksum: 13d909d14

Time (s): cpu = 00:00:00 ; elapsed = 00:00:00.177 . Memory (MB): peak = 1845.090 ; gain = 0.000
INFO: [Opt 31-389] Phase Constant propagation created 43 cells and removed 136 cells

Phase 3 Sweep
Phase 3 Sweep | Checksum: 227ee3b88

Time (s): cpu = 00:00:00 ; elapsed = 00:00:00.216 . Memory (MB): peak = 1845.090 ; gain = 0.000
INFO: [Opt 31-389] Phase Sweep created 0 cells and removed 1 cells

Phase 4 BUFG optimization
Phase 4 BUFG optimization | Checksum: 227ee3b88

Time (s): cpu = 00:00:00 ; elapsed = 00:00:00.267 . Memory (MB): peak = 1845.090 ; gain = 0.000
INFO: [Opt 31-662] Phase BUFG optimization created 0 cells of which 0 are BUFGs and removed 0 cells.

Phase 5 Shift Register Optimization
INFO: [Opt 31-1064] SRL Remap converted 0 SRLs to 0 registers and converted 0 registers of register chains to 0 SRLs
Phase 5 Shift Register Optimization | Checksum: 227ee3b88

Time (s): cpu = 00:00:00 ; elapsed = 00:00:00.271 . Memory (MB): peak = 1845.090 ; gain = 0.000
INFO: [Opt 31-389] Phase Shift Register Optimization created 0 cells and removed 0 cells

Phase 6 Post Processing Netlist
Phase 6 Post Processing Netlist | Checksum: 227ee3b88

Time (s): cpu = 00:00:00 ; elapsed = 00:00:00.278 . Memory (MB): peak = 1845.090 ; gain = 0.000
INFO: [Opt 31-389] Phase Post Processing Netlist created 0 cells and removed 0 cells
Opt_design Change Summary
=========================


-------------------------------------------------------------------------------------------------------------------------
|  Phase                        |  #Cells created  |  #Cells Removed  |  #Constrained objects preventing optimizations  |
-------------------------------------------------------------------------------------------------------------------------
|  Retarget                     |               0  |               0  |                                              0  |
|  Constant propagation         |              43  |             136  |                                              0  |
|  Sweep                        |               0  |               1  |                                              0  |
|  BUFG optimization            |               0  |               0  |                                              0  |
|  Shift Register Optimization  |               0  |               0  |                                              0  |
|  Post Processing Netlist      |               0  |               0  |                                              0  |
-------------------------------------------------------------------------------------------------------------------------



Starting Connectivity Check Task

Time (s): cpu = 00:00:00 ; elapsed = 00:00:00.003 . Memory (MB): peak = 1845.090 ; gain = 0.000
Ending Logic Optimization Task | Checksum: c86259a0

Time (s): cpu = 00:00:00 ; elapsed = 00:00:00.372 . Memory (MB): peak = 1845.090 ; gain = 0.000

Starting Power Optimization Task
INFO: [Pwropt 34-132] Skipping clock gating for clocks with a period < 2.00 ns.
Ending Power Optimization Task | Checksum: c86259a0

Time (s): cpu = 00:00:00 ; elapsed = 00:00:00.015 . Memory (MB): peak = 1845.090 ; gain = 0.000

Starting Final Cleanup Task
Ending Final Cleanup Task | Checksum: c86259a0

Time (s): cpu = 00:00:00 ; elapsed = 00:00:00 . Memory (MB): peak = 1845.090 ; gain = 0.000

Starting Netlist Obfuscation Task
Netlist sorting complete. Time (s): cpu = 00:00:00 ; elapsed = 00:00:00 . Memory (MB): peak = 1845.090 ; gain = 0.000
Ending Netlist Obfuscation Task | Checksum: c86259a0

Time (s): cpu = 00:00:00 ; elapsed = 00:00:00.001 . Memory (MB): peak = 1845.090 ; gain = 0.000
INFO: [Common 17-83] Releasing license: Implementation
25 Infos, 1 Warnings, 1 Critical Warnings and 0 Errors encountered.
opt_design completed successfully
opt_design: Time (s): cpu = 00:00:12 ; elapsed = 00:00:14 . Memory (MB): peak = 1845.090 ; gain = 750.004
INFO: [Timing 38-480] Writing timing data to binary archive.
Writing XDEF routing.
Writing XDEF routing logical nets.
Writing XDEF routing special nets.
Write XDEF Complete: Time (s): cpu = 00:00:00 ; elapsed = 00:00:00.039 . Memory (MB): peak = 1845.090 ; gain = 0.000
INFO: [Common 17-1381] The checkpoint 'D:/Github/FlybackConverter-FPGA-based-Digital-Twin/Vivado/flyback_converter_serial.xpr/callPWM/callPWM.runs/impl_1/topModule_opt.dcp' has been generated.
INFO: [runtcl-4] Executing : report_drc -file topModule_drc_opted.rpt -pb topModule_drc_opted.pb -rpx topModule_drc_opted.rpx
Command: report_drc -file topModule_drc_opted.rpt -pb topModule_drc_opted.pb -rpx topModule_drc_opted.rpx
INFO: [IP_Flow 19-1839] IP Catalog is up to date.
INFO: [DRC 23-27] Running DRC with 2 threads
INFO: [Vivado_Tcl 2-168] The results of DRC are in file D:/Github/FlybackConverter-FPGA-based-Digital-Twin/Vivado/flyback_converter_serial.xpr/callPWM/callPWM.runs/impl_1/topModule_drc_opted.rpt.
report_drc completed successfully
Command: place_design
Attempting to get a license for feature 'Implementation' and/or device 'xc7s50'
INFO: [Common 17-349] Got license for feature 'Implementation' and/or device 'xc7s50'
INFO: [DRC 23-27] Running DRC with 2 threads
INFO: [Vivado_Tcl 4-198] DRC finished with 0 Errors
INFO: [Vivado_Tcl 4-199] Please refer to the DRC report (report_drc) for more information.
Running DRC as a precondition to command place_design
INFO: [DRC 23-27] Running DRC with 2 threads
INFO: [Vivado_Tcl 4-198] DRC finished with 0 Errors
INFO: [Vivado_Tcl 4-199] Please refer to the DRC report (report_drc) for more information.

Starting Placer Task
INFO: [Place 30-611] Multithreading enabled for place_design using a maximum of 2 CPUs

Phase 1 Placer Initialization

Phase 1.1 Placer Initialization Netlist Sorting
Netlist sorting complete. Time (s): cpu = 00:00:00 ; elapsed = 00:00:00.001 . Memory (MB): peak = 1845.090 ; gain = 0.000
Phase 1.1 Placer Initialization Netlist Sorting | Checksum: 87acbede

Time (s): cpu = 00:00:00 ; elapsed = 00:00:00.012 . Memory (MB): peak = 1845.090 ; gain = 0.000
Netlist sorting complete. Time (s): cpu = 00:00:00 ; elapsed = 00:00:00.001 . Memory (MB): peak = 1845.090 ; gain = 0.000

Phase 1.2 IO Placement/ Clock Placement/ Build Placer Device
INFO: [Timing 38-35] Done setting XDC timing constraints.
Phase 1.2 IO Placement/ Clock Placement/ Build Placer Device | Checksum: fda8af7c

Time (s): cpu = 00:00:01 ; elapsed = 00:00:00.506 . Memory (MB): peak = 1845.090 ; gain = 0.000

Phase 1.3 Build Placer Netlist Model
Phase 1.3 Build Placer Netlist Model | Checksum: 118da4ab5

Time (s): cpu = 00:00:01 ; elapsed = 00:00:00.678 . Memory (MB): peak = 1845.090 ; gain = 0.000

Phase 1.4 Constrain Clocks/Macros
Phase 1.4 Constrain Clocks/Macros | Checksum: 118da4ab5

Time (s): cpu = 00:00:01 ; elapsed = 00:00:00.683 . Memory (MB): peak = 1845.090 ; gain = 0.000
Phase 1 Placer Initialization | Checksum: 118da4ab5

Time (s): cpu = 00:00:01 ; elapsed = 00:00:00.691 . Memory (MB): peak = 1845.090 ; gain = 0.000

Phase 2 Global Placement

Phase 2.1 Floorplanning
Phase 2.1 Floorplanning | Checksum: 118da4ab5

Time (s): cpu = 00:00:01 ; elapsed = 00:00:00.703 . Memory (MB): peak = 1845.090 ; gain = 0.000

Phase 2.2 Update Timing before SLR Path Opt
Phase 2.2 Update Timing before SLR Path Opt | Checksum: 118da4ab5

Time (s): cpu = 00:00:01 ; elapsed = 00:00:00.704 . Memory (MB): peak = 1845.090 ; gain = 0.000

Phase 2.3 Post-Processing in Floorplanning
Phase 2.3 Post-Processing in Floorplanning | Checksum: 118da4ab5

Time (s): cpu = 00:00:01 ; elapsed = 00:00:00.704 . Memory (MB): peak = 1845.090 ; gain = 0.000

Phase 2.4 Global Placement Core
WARNING: [Place 46-29] Timing had been disabled during Placer and, therefore, physical synthesis in Placer will be skipped.
Phase 2.4 Global Placement Core | Checksum: 1aa679a36

Time (s): cpu = 00:00:02 ; elapsed = 00:00:03 . Memory (MB): peak = 1845.090 ; gain = 0.000
Phase 2 Global Placement | Checksum: 1aa679a36

Time (s): cpu = 00:00:02 ; elapsed = 00:00:03 . Memory (MB): peak = 1845.090 ; gain = 0.000

Phase 3 Detail Placement

Phase 3.1 Commit Multi Column Macros
Phase 3.1 Commit Multi Column Macros | Checksum: 1aa679a36

Time (s): cpu = 00:00:02 ; elapsed = 00:00:03 . Memory (MB): peak = 1845.090 ; gain = 0.000

Phase 3.2 Commit Most Macros & LUTRAMs
Phase 3.2 Commit Most Macros & LUTRAMs | Checksum: 213c4f384

Time (s): cpu = 00:00:02 ; elapsed = 00:00:03 . Memory (MB): peak = 1845.090 ; gain = 0.000

Phase 3.3 Area Swap Optimization
Phase 3.3 Area Swap Optimization | Checksum: 1a55595b3

Time (s): cpu = 00:00:02 ; elapsed = 00:00:03 . Memory (MB): peak = 1845.090 ; gain = 0.000

Phase 3.4 Pipeline Register Optimization
Phase 3.4 Pipeline Register Optimization | Checksum: 163d31e6d

Time (s): cpu = 00:00:02 ; elapsed = 00:00:03 . Memory (MB): peak = 1845.090 ; gain = 0.000

Phase 3.5 Small Shape Detail Placement
Phase 3.5 Small Shape Detail Placement | Checksum: 21522d9ca

Time (s): cpu = 00:00:03 ; elapsed = 00:00:03 . Memory (MB): peak = 1845.090 ; gain = 0.000

Phase 3.6 Re-assign LUT pins
Phase 3.6 Re-assign LUT pins | Checksum: 21522d9ca

Time (s): cpu = 00:00:03 ; elapsed = 00:00:03 . Memory (MB): peak = 1845.090 ; gain = 0.000

Phase 3.7 Pipeline Register Optimization
Phase 3.7 Pipeline Register Optimization | Checksum: 21522d9ca

Time (s): cpu = 00:00:03 ; elapsed = 00:00:03 . Memory (MB): peak = 1845.090 ; gain = 0.000
Phase 3 Detail Placement | Checksum: 21522d9ca

Time (s): cpu = 00:00:03 ; elapsed = 00:00:03 . Memory (MB): peak = 1845.090 ; gain = 0.000

Phase 4 Post Placement Optimization and Clean-Up

Phase 4.1 Post Commit Optimization
Phase 4.1 Post Commit Optimization | Checksum: 21522d9ca

Time (s): cpu = 00:00:03 ; elapsed = 00:00:03 . Memory (MB): peak = 1845.090 ; gain = 0.000

Phase 4.2 Post Placement Cleanup
Phase 4.2 Post Placement Cleanup | Checksum: 21522d9ca

Time (s): cpu = 00:00:03 ; elapsed = 00:00:03 . Memory (MB): peak = 1845.090 ; gain = 0.000

Phase 4.3 Placer Reporting

Phase 4.3.1 Print Estimated Congestion
INFO: [Place 30-612] Post-Placement Estimated Congestion 
 ____________________________________________________
|           | Global Congestion | Short Congestion  |
| Direction | Region Size       | Region Size       |
|___________|___________________|___________________|
|      North|                1x1|                1x1|
|___________|___________________|___________________|
|      South|                1x1|                1x1|
|___________|___________________|___________________|
|       East|                1x1|                1x1|
|___________|___________________|___________________|
|       West|                1x1|                1x1|
|___________|___________________|___________________|

Phase 4.3.1 Print Estimated Congestion | Checksum: 21522d9ca

Time (s): cpu = 00:00:03 ; elapsed = 00:00:03 . Memory (MB): peak = 1845.090 ; gain = 0.000
Phase 4.3 Placer Reporting | Checksum: 21522d9ca

Time (s): cpu = 00:00:03 ; elapsed = 00:00:03 . Memory (MB): peak = 1845.090 ; gain = 0.000

Phase 4.4 Final Placement Cleanup
Netlist sorting complete. Time (s): cpu = 00:00:00 ; elapsed = 00:00:00 . Memory (MB): peak = 1845.090 ; gain = 0.000

Time (s): cpu = 00:00:03 ; elapsed = 00:00:03 . Memory (MB): peak = 1845.090 ; gain = 0.000
Phase 4 Post Placement Optimization and Clean-Up | Checksum: 269d56c6b

Time (s): cpu = 00:00:03 ; elapsed = 00:00:03 . Memory (MB): peak = 1845.090 ; gain = 0.000
Ending Placer Task | Checksum: 1f3761a0e

Time (s): cpu = 00:00:03 ; elapsed = 00:00:03 . Memory (MB): peak = 1845.090 ; gain = 0.000
INFO: [Common 17-83] Releasing license: Implementation
42 Infos, 2 Warnings, 1 Critical Warnings and 0 Errors encountered.
place_design completed successfully
INFO: [Timing 38-480] Writing timing data to binary archive.
Writing XDEF routing.
Writing XDEF routing logical nets.
Writing XDEF routing special nets.
Write XDEF Complete: Time (s): cpu = 00:00:00 ; elapsed = 00:00:00.203 . Memory (MB): peak = 1850.328 ; gain = 5.238
INFO: [Common 17-1381] The checkpoint 'D:/Github/FlybackConverter-FPGA-based-Digital-Twin/Vivado/flyback_converter_serial.xpr/callPWM/callPWM.runs/impl_1/topModule_placed.dcp' has been generated.
INFO: [runtcl-4] Executing : report_io -file topModule_io_placed.rpt
report_io: Time (s): cpu = 00:00:00 ; elapsed = 00:00:00.049 . Memory (MB): peak = 1850.328 ; gain = 0.000
INFO: [runtcl-4] Executing : report_utilization -file topModule_utilization_placed.rpt -pb topModule_utilization_placed.pb
INFO: [runtcl-4] Executing : report_control_sets -verbose -file topModule_control_sets_placed.rpt
report_control_sets: Time (s): cpu = 00:00:00 ; elapsed = 00:00:00.004 . Memory (MB): peak = 1850.328 ; gain = 0.000
Command: phys_opt_design
Attempting to get a license for feature 'Implementation' and/or device 'xc7s50'
INFO: [Common 17-349] Got license for feature 'Implementation' and/or device 'xc7s50'

Starting Initial Update Timing Task

Time (s): cpu = 00:00:00 ; elapsed = 00:00:00.085 . Memory (MB): peak = 1850.328 ; gain = 0.000
INFO: [Vivado_Tcl 4-235] No timing constraint found. The netlist was not modified.
INFO: [Common 17-83] Releasing license: Implementation
50 Infos, 2 Warnings, 1 Critical Warnings and 0 Errors encountered.
phys_opt_design completed successfully
INFO: [Timing 38-480] Writing timing data to binary archive.
Writing XDEF routing.
Writing XDEF routing logical nets.
Writing XDEF routing special nets.
Write XDEF Complete: Time (s): cpu = 00:00:00 ; elapsed = 00:00:00.231 . Memory (MB): peak = 1861.922 ; gain = 11.594
INFO: [Common 17-1381] The checkpoint 'D:/Github/FlybackConverter-FPGA-based-Digital-Twin/Vivado/flyback_converter_serial.xpr/callPWM/callPWM.runs/impl_1/topModule_physopt.dcp' has been generated.
Command: route_design
Attempting to get a license for feature 'Implementation' and/or device 'xc7s50'
INFO: [Common 17-349] Got license for feature 'Implementation' and/or device 'xc7s50'
Running DRC as a precondition to command route_design
INFO: [DRC 23-27] Running DRC with 2 threads
INFO: [Vivado_Tcl 4-198] DRC finished with 0 Errors
INFO: [Vivado_Tcl 4-199] Please refer to the DRC report (report_drc) for more information.


Starting Routing Task
INFO: [Route 35-254] Multithreading enabled for route_design using a maximum of 2 CPUs

Phase 1 Build RT Design
Checksum: PlaceDB: fb3493f2 ConstDB: 0 ShapeSum: f841861c RouteDB: 0
Post Restoration Checksum: NetGraph: 672403fc NumContArr: ba546392 Constraints: 0 Timing: 0
Phase 1 Build RT Design | Checksum: 12178678e

Time (s): cpu = 00:00:24 ; elapsed = 00:00:26 . Memory (MB): peak = 1945.074 ; gain = 70.004

Phase 2 Router Initialization
INFO: [Route 35-64] No timing constraints were detected. The router will operate in resource-optimization mode.

Phase 2.1 Fix Topology Constraints
Phase 2.1 Fix Topology Constraints | Checksum: 12178678e

Time (s): cpu = 00:00:24 ; elapsed = 00:00:26 . Memory (MB): peak = 1951.137 ; gain = 76.066

Phase 2.2 Pre Route Cleanup
Phase 2.2 Pre Route Cleanup | Checksum: 12178678e

Time (s): cpu = 00:00:24 ; elapsed = 00:00:26 . Memory (MB): peak = 1951.137 ; gain = 76.066
 Number of Nodes with overlaps = 0

Router Utilization Summary
  Global Vertical Routing Utilization    = 0 %
  Global Horizontal Routing Utilization  = 0 %
  Routable Net Status*
  *Does not include unroutable nets such as driverless and loadless.
  Run report_route_status for detailed report.
  Number of Failed Nets               = 1412
    (Failed Nets is the sum of unrouted and partially routed nets)
  Number of Unrouted Nets             = 1412
  Number of Partially Routed Nets     = 0
  Number of Node Overlaps             = 0

Phase 2 Router Initialization | Checksum: 0438c600

Time (s): cpu = 00:00:24 ; elapsed = 00:00:26 . Memory (MB): peak = 1959.723 ; gain = 84.652

Phase 3 Initial Routing

Phase 3.1 Global Routing
Phase 3.1 Global Routing | Checksum: 0438c600

Time (s): cpu = 00:00:24 ; elapsed = 00:00:26 . Memory (MB): peak = 1959.723 ; gain = 84.652
Phase 3 Initial Routing | Checksum: 1bccb2429

Time (s): cpu = 00:00:25 ; elapsed = 00:00:26 . Memory (MB): peak = 1959.723 ; gain = 84.652

Phase 4 Rip-up And Reroute

Phase 4.1 Global Iteration 0
 Number of Nodes with overlaps = 67
 Number of Nodes with overlaps = 0
Phase 4.1 Global Iteration 0 | Checksum: d834cc7a

Time (s): cpu = 00:00:25 ; elapsed = 00:00:27 . Memory (MB): peak = 1959.723 ; gain = 84.652
Phase 4 Rip-up And Reroute | Checksum: d834cc7a

Time (s): cpu = 00:00:25 ; elapsed = 00:00:27 . Memory (MB): peak = 1959.723 ; gain = 84.652

Phase 5 Delay and Skew Optimization
Phase 5 Delay and Skew Optimization | Checksum: d834cc7a

Time (s): cpu = 00:00:25 ; elapsed = 00:00:27 . Memory (MB): peak = 1959.723 ; gain = 84.652

Phase 6 Post Hold Fix

Phase 6.1 Hold Fix Iter
Phase 6.1 Hold Fix Iter | Checksum: d834cc7a

Time (s): cpu = 00:00:25 ; elapsed = 00:00:27 . Memory (MB): peak = 1959.723 ; gain = 84.652
Phase 6 Post Hold Fix | Checksum: d834cc7a

Time (s): cpu = 00:00:25 ; elapsed = 00:00:27 . Memory (MB): peak = 1959.723 ; gain = 84.652

Phase 7 Route finalize

Router Utilization Summary
  Global Vertical Routing Utilization    = 0.260623 %
  Global Horizontal Routing Utilization  = 0.292946 %
  Routable Net Status*
  *Does not include unroutable nets such as driverless and loadless.
  Run report_route_status for detailed report.
  Number of Failed Nets               = 0
    (Failed Nets is the sum of unrouted and partially routed nets)
  Number of Unrouted Nets             = 0
  Number of Partially Routed Nets     = 0
  Number of Node Overlaps             = 0

Congestion Report
North Dir 1x1 Area, Max Cong = 21.6216%, No Congested Regions.
South Dir 1x1 Area, Max Cong = 31.5315%, No Congested Regions.
East Dir 1x1 Area, Max Cong = 33.8235%, No Congested Regions.
West Dir 1x1 Area, Max Cong = 26.4706%, No Congested Regions.

------------------------------
Reporting congestion hotspots
------------------------------
Direction: North
----------------
Congested clusters found at Level 0
Effective congestion level: 0 Aspect Ratio: 1 Sparse Ratio: 0
Direction: South
----------------
Congested clusters found at Level 0
Effective congestion level: 0 Aspect Ratio: 1 Sparse Ratio: 0
Direction: East
----------------
Congested clusters found at Level 0
Effective congestion level: 0 Aspect Ratio: 1 Sparse Ratio: 0
Direction: West
----------------
Congested clusters found at Level 0
Effective congestion level: 0 Aspect Ratio: 1 Sparse Ratio: 0

Phase 7 Route finalize | Checksum: d834cc7a

Time (s): cpu = 00:00:25 ; elapsed = 00:00:27 . Memory (MB): peak = 1959.723 ; gain = 84.652

Phase 8 Verifying routed nets

 Verification completed successfully
Phase 8 Verifying routed nets | Checksum: d834cc7a

Time (s): cpu = 00:00:25 ; elapsed = 00:00:27 . Memory (MB): peak = 1960.383 ; gain = 85.312

Phase 9 Depositing Routes
Phase 9 Depositing Routes | Checksum: eb38352e

Time (s): cpu = 00:00:25 ; elapsed = 00:00:27 . Memory (MB): peak = 1960.383 ; gain = 85.312
INFO: [Route 35-16] Router Completed Successfully

Time (s): cpu = 00:00:25 ; elapsed = 00:00:27 . Memory (MB): peak = 1960.383 ; gain = 85.312

Routing Is Done.
INFO: [Common 17-83] Releasing license: Implementation
60 Infos, 2 Warnings, 1 Critical Warnings and 0 Errors encountered.
route_design completed successfully
route_design: Time (s): cpu = 00:00:26 ; elapsed = 00:00:28 . Memory (MB): peak = 1960.383 ; gain = 98.461
INFO: [Timing 38-480] Writing timing data to binary archive.
Writing XDEF routing.
Writing XDEF routing logical nets.
Writing XDEF routing special nets.
Write XDEF Complete: Time (s): cpu = 00:00:00 ; elapsed = 00:00:00.215 . Memory (MB): peak = 1972.219 ; gain = 11.836
INFO: [Common 17-1381] The checkpoint 'D:/Github/FlybackConverter-FPGA-based-Digital-Twin/Vivado/flyback_converter_serial.xpr/callPWM/callPWM.runs/impl_1/topModule_routed.dcp' has been generated.
INFO: [runtcl-4] Executing : report_drc -file topModule_drc_routed.rpt -pb topModule_drc_routed.pb -rpx topModule_drc_routed.rpx
Command: report_drc -file topModule_drc_routed.rpt -pb topModule_drc_routed.pb -rpx topModule_drc_routed.rpx
INFO: [IP_Flow 19-1839] IP Catalog is up to date.
INFO: [DRC 23-27] Running DRC with 2 threads
INFO: [Vivado_Tcl 2-168] The results of DRC are in file D:/Github/FlybackConverter-FPGA-based-Digital-Twin/Vivado/flyback_converter_serial.xpr/callPWM/callPWM.runs/impl_1/topModule_drc_routed.rpt.
report_drc completed successfully
INFO: [runtcl-4] Executing : report_methodology -file topModule_methodology_drc_routed.rpt -pb topModule_methodology_drc_routed.pb -rpx topModule_methodology_drc_routed.rpx
Command: report_methodology -file topModule_methodology_drc_routed.rpt -pb topModule_methodology_drc_routed.pb -rpx topModule_methodology_drc_routed.rpx
INFO: [Timing 38-35] Done setting XDC timing constraints.
INFO: [DRC 23-133] Running Methodology with 2 threads
INFO: [Vivado_Tcl 2-1520] The results of Report Methodology are in file D:/Github/FlybackConverter-FPGA-based-Digital-Twin/Vivado/flyback_converter_serial.xpr/callPWM/callPWM.runs/impl_1/topModule_methodology_drc_routed.rpt.
report_methodology completed successfully
INFO: [runtcl-4] Executing : report_power -file topModule_power_routed.rpt -pb topModule_power_summary_routed.pb -rpx topModule_power_routed.rpx
Command: report_power -file topModule_power_routed.rpt -pb topModule_power_summary_routed.pb -rpx topModule_power_routed.rpx
INFO: [Timing 38-35] Done setting XDC timing constraints.
WARNING: [Power 33-232] No user defined clocks were found in the design! Power estimation will be inaccurate until this is corrected.
Resolution: Please specify clocks using create_clock/create_generated_clock for sequential elements. For pure combinatorial circuits, please specify a virtual clock, otherwise the vectorless estimation might be inaccurate
Running Vector-less Activity Propagation...

Finished Running Vector-less Activity Propagation
WARNING: [Designutils 20-274] XADC DRP clock frequency 6250.0 MHz is outside the valid range of 0.0 to 250.0 MHz for power estimation.
72 Infos, 4 Warnings, 1 Critical Warnings and 0 Errors encountered.
report_power completed successfully
INFO: [runtcl-4] Executing : report_route_status -file topModule_route_status.rpt -pb topModule_route_status.pb
INFO: [runtcl-4] Executing : report_timing_summary -max_paths 10 -file topModule_timing_summary_routed.rpt -pb topModule_timing_summary_routed.pb -rpx topModule_timing_summary_routed.rpx -warn_on_violation 
INFO: [Timing 38-91] UpdateTimingParams: Speed grade: -1, Delay Type: min_max.
INFO: [Timing 38-191] Multithreading enabled for timing update using a maximum of 2 CPUs
WARNING: [Timing 38-313] There are no user specified timing constraints. Timing constraints are needed for proper timing analysis.
INFO: [runtcl-4] Executing : report_incremental_reuse -file topModule_incremental_reuse_routed.rpt
INFO: [Vivado_Tcl 4-1062] Incremental flow is disabled. No incremental reuse Info to report.
INFO: [runtcl-4] Executing : report_clock_utilization -file topModule_clock_utilization_routed.rpt
INFO: [runtcl-4] Executing : report_bus_skew -warn_on_violation -file topModule_bus_skew_routed.rpt -pb topModule_bus_skew_routed.pb -rpx topModule_bus_skew_routed.rpx
INFO: [Timing 38-91] UpdateTimingParams: Speed grade: -1, Delay Type: min_max.
INFO: [Timing 38-191] Multithreading enabled for timing update using a maximum of 2 CPUs
INFO: [Common 17-206] Exiting Vivado at Mon Jun 26 22:12:09 2023...

*** Running vivado
    with args -log topModule.vdi -applog -m64 -product Vivado -messageDb vivado.pb -mode batch -source topModule.tcl -notrace



****** Vivado v2022.2 (64-bit)
  **** SW Build 3671981 on Fri Oct 14 05:00:03 MDT 2022
  **** IP Build 3669848 on Fri Oct 14 08:30:02 MDT 2022
    ** Copyright 1986-2022 Xilinx, Inc. All Rights Reserved.

source topModule.tcl -notrace
Command: open_checkpoint topModule_routed.dcp
INFO: [Device 21-403] Loading part xc7s50csga324-1
Netlist sorting complete. Time (s): cpu = 00:00:00 ; elapsed = 00:00:00.011 . Memory (MB): peak = 953.848 ; gain = 0.000
INFO: [Netlist 29-17] Analyzing 246 Unisim elements for replacement
INFO: [Netlist 29-28] Unisim Transformation completed in 1 CPU seconds
INFO: [Project 1-479] Netlist was created with Vivado 2022.2
INFO: [Project 1-570] Preparing netlist for logic optimization
INFO: [Timing 38-478] Restoring timing data from binary archive.
INFO: [Timing 38-479] Binary timing data restore complete.
INFO: [Project 1-856] Restoring constraints from binary archive.
INFO: [Project 1-853] Binary constraint restore complete.
Reading XDEF placement.
Reading placer database...
Reading XDEF routing.
Read XDEF Files: Time (s): cpu = 00:00:00 ; elapsed = 00:00:00.214 . Memory (MB): peak = 1489.074 ; gain = 15.539
Restored from archive | CPU: 0.000000 secs | Memory: 0.000000 MB |
Finished XDEF File Restore: Time (s): cpu = 00:00:00 ; elapsed = 00:00:00.215 . Memory (MB): peak = 1489.074 ; gain = 15.539
Netlist sorting complete. Time (s): cpu = 00:00:00 ; elapsed = 00:00:00 . Memory (MB): peak = 1489.074 ; gain = 0.000
INFO: [Project 1-111] Unisim Transformation Summary:
No Unisim elements were transformed.

INFO: [Project 1-604] Checkpoint was created with Vivado v2022.2 (64-bit) build 3671981
OpenCheckpoint Checksum | Checksum: 117170e16
----- Checksum: PlaceDB: 053f7375 ShapeSum: f841861c RouteDB: 19961485 
open_checkpoint: Time (s): cpu = 00:00:18 ; elapsed = 00:00:21 . Memory (MB): peak = 1489.074 ; gain = 1057.438
Command: write_bitstream -force topModule.bit
Attempting to get a license for feature 'Implementation' and/or device 'xc7s50'
INFO: [Common 17-349] Got license for feature 'Implementation' and/or device 'xc7s50'
Running DRC as a precondition to command write_bitstream
INFO: [IP_Flow 19-234] Refreshing IP repositories
INFO: [IP_Flow 19-1704] No user IP repositories specified
INFO: [IP_Flow 19-2313] Loaded Vivado IP repository 'D:/Vivado/2022.2/data/ip'.
INFO: [DRC 23-27] Running DRC with 2 threads
WARNING: [DRC DPIP-1] Input pipelining: DSP PID_inst/Product1_mul_temp__0 input PID_inst/Product1_mul_temp__0/A[29:0] is not pipelined. Pipelining DSP48 input will improve performance.
INFO: [Vivado 12-3199] DRC finished with 0 Errors, 1 Warnings
INFO: [Vivado 12-3200] Please refer to the DRC report (report_drc) for more information.
INFO: [Designutils 20-2272] Running write_bitstream with 2 threads.
Loading data files...
Loading site data...
Loading route data...
Processing options...
Creating bitmap...
Creating bitstream...
Writing bitstream ./topModule.bit...
INFO: [Vivado 12-1842] Bitgen Completed Successfully.
INFO: [Project 1-1876] WebTalk data collection is mandatory when using a ULT device. To see the specific WebTalk data collected for your design, open the usage_statistics_webtalk.html or usage_statistics_webtalk.xml file in the implementation directory.
INFO: [Common 17-83] Releasing license: Implementation
22 Infos, 1 Warnings, 0 Critical Warnings and 0 Errors encountered.
write_bitstream completed successfully
write_bitstream: Time (s): cpu = 00:00:13 ; elapsed = 00:00:13 . Memory (MB): peak = 1977.711 ; gain = 488.637
INFO: [Common 17-206] Exiting Vivado at Mon Jun 26 22:13:09 2023...
